{
  "boundary_dataset_id": "natural-earth:admin-0-countries-110m",
  "boundary_dataset_version": "v5.1.2+f1890d9f",
  "country_hierarchy_id": "country-hierarchy:natural-earth-v5.1.2-110m",
  "created_at": "2026-07-17T11:04:00Z",
  "nodes": [
    {
      "admin1": null,
      "admin1_code": null,
      "bounds": [
        -180.0,
        -90.0,
        180.0,
        90.0
      ],
      "centroid_latitude": 0.0,
      "centroid_longitude": 0.0,
      "continent": null,
      "country": null,
      "country_code": null,
      "geometry_feature_id": null,
      "parent_scope_id": null,
      "scope_id": "global",
      "scope_level": "global",
      "scope_name": "Global",
      "sort_key": "00-global"
    },
    {
      "admin1": null,
      "admin1_code": null,
      "bounds": [
        -17.625043,
        -49.775,
        70.56,
        37.349994
      ],
      "centroid_latitude": 3.25816,
      "centroid_longitude": 17.313899,
      "continent": "Africa",
      "country": null,
      "country_code": null,
      "geometry_feature_id": null,
      "parent_scope_id": "global",
      "scope_id": "continent:africa",
      "scope_level": "continent",
      "scope_name": "Africa",
      "sort_key": "10-01-Africa"
    },
    {
      "admin1": null,
      "admin1_code": null,
      "bounds": [
        -180.0,
        -90.0,
        180.0,
        -63.27066
      ],
      "centroid_latitude": -79.843222,
      "centroid_longitude": 35.885455,
      "continent": "Antarctica",
      "country": null,
      "country_code": null,
      "geometry_feature_id": null,
      "parent_scope_id": "global",
      "scope_id": "continent:antarctica",
      "scope_level": "continent",
      "scope_name": "Antarctica",
      "sort_key": "10-02-Antarctica"
    },
    {
      "admin1": null,
      "admin1_code": null,
      "bounds": [
        26.043351,
        -10.359987,
        145.543137,
        55.38525
      ],
      "centroid_latitude": 27.613418,
      "centroid_longitude": 75.024725,
      "continent": "Asia",
      "country": null,
      "country_code": null,
      "geometry_feature_id": null,
      "parent_scope_id": "global",
      "scope_id": "continent:asia",
      "scope_level": "continent",
      "scope_name": "Asia",
      "sort_key": "10-03-Asia"
    },
    {
      "admin1": null,
      "admin1_code": null,
      "bounds": [
        -180.0,
        2.053389,
        180.0,
        81.2504
      ],
      "centroid_latitude": 49.7763,
      "centroid_longitude": 15.185799,
      "continent": "Europe",
      "country": null,
      "country_code": null,
      "geometry_feature_id": null,
      "parent_scope_id": "global",
      "scope_id": "continent:europe",
      "scope_level": "continent",
      "scope_name": "Europe",
      "sort_key": "10-04-Europe"
    },
    {
      "admin1": null,
      "admin1_code": null,
      "bounds": [
        -171.791111,
        7.220541,
        -12.20855,
        83.64513
      ],
      "centroid_latitude": 23.538818,
      "centroid_longitude": -80.45689,
      "continent": "North America",
      "country": null,
      "country_code": null,
      "geometry_feature_id": null,
      "parent_scope_id": "global",
      "scope_id": "continent:north-america",
      "scope_level": "continent",
      "scope_name": "North America",
      "sort_key": "10-05-North America"
    },
    {
      "admin1": null,
      "admin1_code": null,
      "bounds": [
        -180.0,
        -46.641235,
        180.0,
        -2.500002
      ],
      "centroid_latitude": -18.839383,
      "centroid_longitude": 159.983657,
      "continent": "Oceania",
      "country": null,
      "country_code": null,
      "geometry_feature_id": null,
      "parent_scope_id": "global",
      "scope_id": "continent:oceania",
      "scope_level": "continent",
      "scope_name": "Oceania",
      "sort_key": "10-06-Oceania"
    },
    {
      "admin1": null,
      "admin1_code": null,
      "bounds": [
        -81.410943,
        -55.61183,
        -34.729993,
        12.437303
      ],
      "centroid_latitude": -15.467234,
      "centroid_longitude": -63.785605,
      "continent": "South America",
      "country": null,
      "country_code": null,
      "geometry_feature_id": null,
      "parent_scope_id": "global",
      "scope_id": "continent:south-america",
      "scope_level": "continent",
      "scope_name": "South America",
      "sort_key": "10-07-South America"
    },
    {
      "admin1": null,
      "admin1_code": null,
      "bounds": [
        51.579519,
        22.496948,
        56.396847,
        26.055464
      ],
      "centroid_latitude": 23.466285,
      "centroid_longitude": 54.547256,
      "continent": "Asia",
      "country": "United Arab Emirates",
      "country_code": "AE",
      "geometry_feature_id": "ne:1159320329",
      "parent_scope_id": "continent:asia",
      "scope_id": "country:AE",
      "scope_level": "country",
      "scope_name": "United Arab Emirates",
      "sort_key": "20-Asia-United Arab Emirates-AE"
    },
    {
      "admin1": null,
      "admin1_code": null,
      "bounds": [
        60.52843,
        29.318572,
        75.158028,
        38.486282
      ],
      "centroid_latitude": 34.164262,
      "centroid_longitude": 66.496586,
      "continent": "Asia",
      "country": "Afghanistan",
      "country_code": "AF",
      "geometry_feature_id": "ne:1159320319",
      "parent_scope_id": "continent:asia",
      "scope_id": "country:AF",
      "scope_level": "country",
      "scope_name": "Afghanistan",
      "sort_key": "20-Asia-Afghanistan-AF"
    },
    {
      "admin1": null,
      "admin1_code": null,
      "bounds": [
        19.304486,
        39.624998,
        21.02004,
        42.688247
      ],
      "centroid_latitude": 40.654855,
      "centroid_longitude": 20.11384,
      "continent": "Europe",
      "country": "Albania",
      "country_code": "AL",
      "geometry_feature_id": "ne:1159320325",
      "parent_scope_id": "continent:europe",
      "scope_id": "country:AL",
      "scope_level": "country",
      "scope_name": "Albania",
      "sort_key": "20-Europe-Albania-AL"
    },
    {
      "admin1": null,
      "admin1_code": null,
      "bounds": [
        43.582746,
        38.741201,
        46.50572,
        41.248129
      ],
      "centroid_latitude": 40.459077,
      "centroid_longitude": 44.800564,
      "continent": "Asia",
      "country": "Armenia",
      "country_code": "AM",
      "geometry_feature_id": "ne:1159320333",
      "parent_scope_id": "continent:asia",
      "scope_id": "country:AM",
      "scope_level": "country",
      "scope_name": "Armenia",
      "sort_key": "20-Asia-Armenia-AM"
    },
    {
      "admin1": null,
      "admin1_code": null,
      "bounds": [
        11.640096,
        -17.930636,
        24.079905,
        -4.438023
      ],
      "centroid_latitude": -12.182762,
      "centroid_longitude": 17.984249,
      "continent": "Africa",
      "country": "Angola",
      "country_code": "AO",
      "geometry_feature_id": "ne:1159320323",
      "parent_scope_id": "continent:africa",
      "scope_id": "country:AO",
      "scope_level": "country",
      "scope_name": "Angola",
      "sort_key": "20-Africa-Angola-AO"
    },
    {
      "admin1": null,
      "admin1_code": null,
      "bounds": [
        -180.0,
        -90.0,
        180.0,
        -63.27066
      ],
      "centroid_latitude": -79.843222,
      "centroid_longitude": 35.885455,
      "continent": "Antarctica",
      "country": "Antarctica",
      "country_code": "AQ",
      "geometry_feature_id": "ne:1159320335",
      "parent_scope_id": "continent:antarctica",
      "scope_id": "country:AQ",
      "scope_level": "country",
      "scope_name": "Antarctica",
      "sort_key": "20-Antarctica-Antarctica-AQ"
    },
    {
      "admin1": null,
      "admin1_code": null,
      "bounds": [
        -73.415436,
        -55.25,
        -53.628349,
        -21.83231
      ],
      "centroid_latitude": -33.501159,
      "centroid_longitude": -64.173331,
      "continent": "South America",
      "country": "Argentina",
      "country_code": "AR",
      "geometry_feature_id": "ne:1159320331",
      "parent_scope_id": "continent:south-america",
      "scope_id": "country:AR",
      "scope_level": "country",
      "scope_name": "Argentina",
      "sort_key": "20-South America-Argentina-AR"
    },
    {
      "admin1": null,
      "admin1_code": null,
      "bounds": [
        9.47997,
        46.431817,
        16.979667,
        49.039074
      ],
      "centroid_latitude": 47.518859,
      "centroid_longitude": 14.130515,
      "continent": "Europe",
      "country": "Austria",
      "country_code": "AT",
      "geometry_feature_id": "ne:1159320379",
      "parent_scope_id": "continent:europe",
      "scope_id": "country:AT",
      "scope_level": "country",
      "scope_name": "Austria",
      "sort_key": "20-Europe-Austria-AT"
    },
    {
      "admin1": null,
      "admin1_code": null,
      "bounds": [
        113.338953,
        -43.634597,
        153.569469,
        -10.668186
      ],
      "centroid_latitude": -24.129522,
      "centroid_longitude": 134.04972,
      "continent": "Oceania",
      "country": "Australia",
      "country_code": "AU",
      "geometry_feature_id": "ne:1159320355",
      "parent_scope_id": "continent:oceania",
      "scope_id": "country:AU",
      "scope_level": "country",
      "scope_name": "Australia",
      "sort_key": "20-Oceania-Australia-AU"
    },
    {
      "admin1": null,
      "admin1_code": null,
      "bounds": [
        44.79399,
        38.270378,
        50.392821,
        41.860675
      ],
      "centroid_latitude": 40.402387,
      "centroid_longitude": 47.210994,
      "continent": "Asia",
      "country": "Azerbaijan",
      "country_code": "AZ",
      "geometry_feature_id": "ne:1159320381",
      "parent_scope_id": "continent:asia",
      "scope_id": "country:AZ",
      "scope_level": "country",
      "scope_name": "Azerbaijan",